"Title","Href","Author","Date","Abstract","Keywords","University Name"
"2D and 3D computer vision analysis of gaze, gender and age","https://uwe-repository.worktribe.com/output/801890/2d-and-3d-computer-vision-analysis-of-gaze-gender-and-age","Wenhao Zhang","None","Human-Computer Interaction (HCI) has been an active research area for over four decades. Research studies and commercial designs in this area have been largely facilitated by the visual modality which brings diversified functionality and improved usability to HCI interfaces by employing various computer vision techniques. This thesis explores a number of facial cues, such as gender, age and gaze, by performing 2D and 3D based computer vision analysis. The ultimate aim is to create a natural HCI strategy that can fulfil user expectations, augment user satisfaction and enrich user experience by understanding user characteristics and behaviours. To this end, salient features have been extracted and analysed from 2D and 3D face representations; 3D reconstruction algorithms and their compatible real-world imaging systems have been investigated; case study HCI systems have been designed to demonstrate the reliability, robustness, and applicability of the proposed method.  More specifically, an unsupervised approach has been proposed to localise eye centres in images and videos accurately and efficiently. This is achieved by utilisation of two types of geometric features and eye models, complemented by an iris radius constraint and a selective oriented gradient filter specifically tailored to this modular scheme. This approach resolves challenges such as interfering facial edges, undesirable illumination conditions, head poses, and the presence of facial accessories and makeup. Tested on 3 publicly available databases (the BioID database, the GI4E database and the extended Yale Face Database b), and a self-collected database, this method outperforms all the methods in comparison and thus proves to be highly accurate and robust. Based on this approach, a gaze gesture recognition algorithm has been designed to increase the interactivity of HCI systems by encoding eye saccades into a communication channel similar to the role of hand gestures. As well as analysing eye/gaze data that represent user behaviours and reveal user intentions, this thesis also investigates the automatic recognition of user demographics such as gender and age. The Fisher Vector encoding algorithm is employed to construct visual vocabularies as salient features for gender and age classification. Algorithm evaluations on three publicly available databases (the FERET database, the LFW database and the FRCVv2 database) demonstrate the superior performance of the proposed method in both laboratory and unconstrained environments. In order to achieve enhanced robustness, a two-source photometric stereo method has been introduced to recover surface normals such that more invariant 3D facia features become available that can further boost classification accuracy and robustness. A 2D+3D imaging system has been designed for construction of a self-collected dataset including 2D and 3D facial data. Experiments show that utilisation of 3D facial features can increase gender classification rate by up to 6% (based on the self-collected dataset), and can increase age classification rate by up to 12% (based on the Photoface database). Finally, two case study HCI systems, a gaze gesture based map browser and a directed advertising billboard, have been designed by adopting all the proposed algorithms as well as the fully compatible imaging system. Benefits from the proposed algorithms naturally ensure that the case study systems can possess high robustness to head pose variation and illumination variation; and can achieve excellent real-time performance. Overall, the proposed HCI strategy enabled by reliably recognised facial cues can serve to spawn a wide array of innovative systems and to bring HCI to a more natural and intelligent state.","Ai","University of the West of England"
"Place-based collaboration: Leadership for a changing world","https://uwe-repository.worktribe.com/output/801927/place-based-collaboration-leadership-for-a-changing-world","Emeritus Professor of City Leadership Robin Hambleton","Dec 18, 2015","Place-less power, meaning the exercise of power by decision makers who are unconcerned about the impact of their decisions on communities living in particular places, has grown significantly in the last thirty years.  A consequence is that societies are becoming more unequal.  Even in the wealthy global cities modern capitalism is increasing inequality at a formidable rate.  In a new book, Leading the Inclusive City (Policy Press), the author provides an international, comparative analysis of the efforts being made by place-based leaders to create inclusive, sustainable cities.  This article draws on the evidence presented in the book to suggest that place-based leaders can play a significant role in advancing social justice, promoting care for the environment and bolstering community empowerment.  An opening section introduces the idea of place-based power – it provides a context for the subsequent discussion. A second section sets out a new way of conceptualising the roles of place-based leaders in any given context, a framework described as The New Civic Leadership.  This distinguishes five different realms of civic leadership.  The third section provides an example of place-based leadership in action.  It outlines the way local leadership has brought about a remarkable transformation of the central area of Melbourne, Australia.  A final section presents a comparative discussion of three themes relating to place-based leadership and local collaboration: 1) The changing possibilities for place-based leadership in our rapidly globalising world; 2) The need for outward-facing local government leadership given the changing nature of public policy challenges; and 3) The role of place-based leadership in bringing about radical public innovation.","Ai","University of the West of England"
"DNA damage and the balance between survival and death in cancer biology","https://uwe-repository.worktribe.com/output/801934/dna-damage-and-the-balance-between-survival-and-death-in-cancer-biology","Wynand P. Roos;  Adam Thomas; Bernd Kaina","Jan 1, 2016","© 2016 Macmillan Publishers Limited. DNA is vulnerable to damage resulting from endogenous metabolites, environmental and dietary carcinogens, some anti-inflammatory drugs, and genotoxic cancer therapeutics. Cells respond to DNA damage by activating complex signalling networks that decide cell fate, promoting not only DNA repair and survival but also cell death. The decision between cell survival and death following DNA damage rests on factors that are involved in DNA damage recognition, and DNA repair and damage tolerance, as well as on factors involved in the activation of apoptosis, necrosis, autophagy and senescence. The pathways that dictate cell fate are entwined and have key roles in cancer initiation and progression. Furthermore, they determine the outcome of cancer therapy with genotoxic drugs. Understanding the molecular basis of these pathways is important not only for gaining insight into carcinogenesis, but also in promoting successful cancer therapy. In this Review, we describe key decision-making nodes in the complex interplay between cell survival and death following DNA damage.","Ai","University of the West of England"
"Development and validation of a high throughput, closed tube method for the determination of haemoglobin alpha gene (HBA1 and HBA2) numbers by gene ratio assay copy enumeration-PCR (GRACE-PCR)","https://uwe-repository.worktribe.com/output/801943/development-and-validation-of-a-high-throughput-closed-tube-method-for-the-determination-of-haemoglobin-alpha-gene-hba1-and-hba2-numbers-by-gene-ratio-assay-copy-enumeration-pcr-grace-pcr","Andrew Turner; Jurgen Sasse;  Aniko Varadi","Dec 18, 2015","© 2015 Turner et al. Background: Deletions of the aα-globin genes are the most common genetic abnormalities in the world. Currently multiplex Gap-PCRs are frequently used to identify specific sets of common deletions. However, these assays require significant post-amplification hands on time and cannot be used to identify novel or unexpected deletions. The aim of the current study was to develop a rapid screening test for the detection of all deletions of the aα-globin genes that can be integrated into a high volume clinical laboratory workflow. Methods: A gene ratio assay copy enumeration (GRACE) PCR method was developed by simultaneous amplification of targets in the aα-globin genes (HBA1 and HBA2) and the chloride channel voltage sensitive 7 (CLCN7) reference gene. A novel application of High Resolution Melting (HRM) analysis then allowed rapid determination of aα-globin gene copy numbers. The assay was validated using 105 samples with previously determined and 62 samples with unknown aα-globin genotypes. Results: The GRACE-PCR assay detected abnormal aα-globin gene copy numbers in 108 of the 167 samples evaluated. The results were consistent with those from a commercial reverse hybridization assay and no allele drop out was observed. Conclusions: We have successfully developed and validated a GRACE-PCR screening test for the detection of deletions and duplications of the aα-globin genes. The assay is based on copy number determination and has the ability to detect both known and novel deletions of the aα-globin genes. It is a closed tube technique; consequently the risk of amplicon contamination is negligible. Amplification, detection and analysis can be completed within one hour, making it faster, cheaper and simpler than other existing tests and thus well suited as a rapid first step in a clinical laboratory workflow.","Ai","University of the West of England"
"Delivering green streets: An exploration of changing perceptions and behaviours over time around bioswales in Portland, Oregon","https://uwe-repository.worktribe.com/output/801954/delivering-green-streets-an-exploration-of-changing-perceptions-and-behaviours-over-time-around-bioswales-in-portland-oregon"," Glyn Everett;  Jessica Lamond; Anita Morzillo; A Marissa Matsler; Faith Chan","Feb 1, 2018","© 2015 The Authors. Journal of Flood Risk Management published by The Chartered Institution of Water and Environmental Management and John Wiley  &  Sons Ltd. Green Infrastructure (GI) is an increasingly popular means of dealing with flooding and water quality issues worldwide. This study examines public perceptions of, and behaviour around, bioswales, which are a popular GI facility in the United States. Bioswales are highly visible interventions requiring support from residents and policy-makers to be implemented and maintained appropriately. To understand how the residents' perceptions and attitudes might develop over time, we interviewed residents of Portland, Oregon, living near bioswales installed 1–2, 4–5 and 8–9 years ago, to determine awareness, understanding, and opinions about the devices. We found no consistent patterns across time periods, but did find common issues affecting residents' appreciation and acceptance: environmental attitudes, awareness and understanding of purpose and function, plant choice and maintenance, and mess and littering. It was apparent that increased public engagement, localised maintenance strategies, and possibly even customising facilities to meet residents' needs where feasible, might improve acceptance.","Ai","University of the West of England"
"Characterizing Indian students pursuing global higher education: A conceptual framework of pathways to internationalization","https://uwe-repository.worktribe.com/output/801973/characterizing-indian-students-pursuing-global-higher-education-a-conceptual-framework-of-pathways-to-internationalization","Dr. Deepak Gopinath","Jan 1, 2015","© 2014 European Association for International Education One might argue that an Indian student entering higher education is faced with a critical question—Where to study, in India or abroad? With a gross enrollment ratio of around 20% in the tertiary sector, only one in five in the 18 to 23 age group of a 140 million eventually gets to answer the question. But those who do, and whose numbers are rapidly increasing, pursue higher education abroad in response to a range of choices presented not only by increasing domestic provision in higher education but also through increased international collaborations (for instance, through branch campuses) that Indian students can avail of without leaving the country. As a result, this presents problems for characterizing the Indian student pursuing higher education abroad. By placing emphasis on the multiple transitions across spaces and tensions between “controlled” and “emergent” mobilities, this article sets out a conceptual framework with which to understand potential pathways into higher education, so that policy makers and educational providers can better understand international mobility in the Indian higher education sector.","Ai","University of the West of England"
"Austen writing Bristol: The city and signification in Northanger Abbey and Emma","https://uwe-repository.worktribe.com/output/801985/austen-writing-bristol-the-city-and-signification-in-northanger-abbey-and-emma"," Gill Ballinger","Dec 16, 2015","This essay suggests that Austen’s portrayal of Bristol in her fiction has two specific functions. First, it underscores her topographical realism: the references to the city and its immediate environs show how her novels are set in the recognizably real world, even if Bristol is not described in great detail. Second, a character’s attitude towards, or connection with, the city and its surrounding area exposes significant aspects of his or her personality. A character’s relationship to place reveals a great deal; furthermore, the aspect of temperament that is exposed in the process may be linked to important wider themes of the particular novel in question. The connection between place and person is part of Austen’s “hyperrealistic” method, a technique whereby she used real life places and their associations to help inform an understanding of her characters (Barchas 9).","Ai","University of the West of England"
"Outsiders and learners: Negotiating meaning in comparative European social work research practice","https://uwe-repository.worktribe.com/output/801990/outsiders-and-learners-negotiating-meaning-in-comparative-european-social-work-research-practice","Staffan ;  Liz Frost; Annamaria Campanini; Alessandro Sicora; Karin Kullberg","Jul 1, 2017","© 2015, © The Author(s) 2015. This paper draws on two experiences of undertaking comparative research in England, Sweden and Italy, and offers a discussion of the kinds of dilemmas raised in relation to language and meaning surfaced by these. Its primary focus is to examine the reflexive construction of meaning, both in relation generally to the workings of an international research team and, more specifically, how such construction of meaning impacts on the process of qualitative interviewing across linguistic and cultural boundaries. The article argues that a culture of reflexive research practice is helpful for approaching national differences, to facilitate understanding in internationally mixed research teams and to support and empower participants in research, in second languages and differing cultures. Overall, the paper attempts to advance some tentative ideas that other international researchers may be able to consider and deploy in relation to their own research ambitions.","Ai","University of the West of England"
"'It gave me a new lease of life...': GPs' views and experiences of supervising foundation doctors in general practice","https://uwe-repository.worktribe.com/output/802007/it-gave-me-a-new-lease-of-life-gps-views-and-experiences-of-supervising-foundation-doctors-in-general-practice"," Abigail Sabey; Michael Harris; Clare Van Hamel","Jan 1, 2016","© 2016 Taylor  &  Francis. Background: General practice is a popular placement in the second year of Foundation training. Evaluations suggest this is a positive experience for most trainee doctors and benefits their perceptions of primary care, but the impact on primary care supervisors has not been considered. At a time when placements may need to increase, understanding the experience of the GP supervisors responsible for these placements is important. Aim:To explore the views, experiences and needs of GPs who supervise F2 doctors in their practices including their perceptions of the benefits to individuals and practices. Design and setting:A qualitative approach with GPs from across Severn Postgraduate Medical Education who supervise F2 doctors. Method: Semi-structured interviews with 15 GPs between December 2012 and April 2013. Results: GP supervisors are enthusiastic about helping F2 doctors to appreciate the uniqueness of primary care. Workload and responsibility around supervision is considerable making a supportive team important. Working with young, enthusiastic doctors boosts morale in the team. The presence of freshly trained minds prompts GPs to consider their own learning needs. Being a supervisor can increase job satisfaction; the teaching role gives respite from the demanding nature of GP work. Conclusion: Supervisors are positive about working with F2s, who lift morale in the team and challenge GPs in their own practice and learning. This boosts job and personal satisfaction. Nonetheless, consideration should be given to managing teaching workload and team support for supervision.","Ai","University of the West of England"
"Cure Over Prevention: The Boost to NHS Funding is at the Expense of Preventative Healthcare","https://uwe-repository.worktribe.com/output/802038/cure-over-prevention-the-boost-to-nhs-funding-is-at-the-expense-of-preventative-healthcare"," Nasrul Ismail","Dec 15, 2015","In the 2015 Spending Review, the government committed to increasing NHS spending by £10bn per year by 2020. The article argues that combined with cuts to funding for public health, the boost means spending is focusing on urgent care and undermines the long-term prevention agenda. The article also explains that a more effective preventative health policy would decrease financial dependencies in the long run, and so the government ought to have invested in it as well.","Ai","University of the West of England"
"Managerial engagement with scenario planning: A conceptual consumption approach","https://uwe-repository.worktribe.com/output/802071/managerial-engagement-with-scenario-planning-a-conceptual-consumption-approach","Abiodun Adegbile; David Sarpong","Jan 1, 2015","Scenario development is widely used to reduce uncertainty while making decisions in high velocity environments. Despite this fact, managerial fixation on short term performance objectives, their penchant fear of the unpredictable future and their sheer inability to face the alternative futures generated in the scenario planning exercises has led to little value capture from this activity. The paper analyzes the factors that determine the willingness of decision-makers, to be actively involved in scenario planning. The authors suggest that effective incentives to promote the interest in this activity and its impact can be found, if we consider the decision-makers, as 'consumers' of certain ideas, concepts, expectations, and competencies. In particular, the paper hypothesizes and validates the assumptions that the selection of appropriate targets for scenario planning, commitment to achieving them, expectations of positive outcomes, increasing the frequency of scenario planning exercises are more likely to be expressed in the growing interest of managers and stakeholders to develop scenarios. The presented results are tested on the most common - intuitive logic approach to scenario planning. The authors expect future research to go further to empirically test the proposed hypotheses, and if possible, ascertain whether similar hypotheses could be generated in the context of other tried and tested scenario planning methodologies such as the probabilistic modified trends, competitive intelligence and cross impact analysis.","Ai","University of the West of England"
"'Studying Leadership Ethnographically: Reflections of a first-time ethnographer'","https://uwe-repository.worktribe.com/output/802079/studying-leadership-ethnographically-reflections-of-a-first-time-ethnographer"," Neil Sutherland","Dec 13, 2015","The last two decades have seen an increase in the number of ethnographic writings in Organisation Studies more generally, however, similar developments have not been mirrored within Leadership Studies, where – despite a recent interpretivist ‘shift’ - the field is still dominated by positivistic approaches. Various theorists have noted the wide-ranging problems associated with this, and have pointed toward ethnography as a way of opening up leadership research and investigating it from a new angle. However, to date it remains underrepresented. Potentially, this could be due to the fact that leadership is a largely ill-defined concept, meaning that being able to recognise it in action is a difficult task, compared with more detached methods. Therefore, this paper suggests that a first step may be developing a broader understanding of leadership – building on the work of Smircich and Morgan (1982) and Fairhurst (2007). That is, understanding leadership as constituted by meaning-making and reality definition, which is performed through discourse (or: intersubjective talk, communication, language and interaction) as well as being influenced by Discourse (or: extrasubjective frames of reference). This paper suggests that ethnographic methodologies are apt for studying both, and may be able to shed new light on the phenomenon.","Ai","University of the West of England"
"A proposed model for servitization based collaboration in the UK Aerospace Defence industry","https://uwe-repository.worktribe.com/output/802094/a-proposed-model-for-servitization-based-collaboration-in-the-uk-aerospace-defence-industry","Neil Barnett","None","In many sectors customers are increasingly seeking service contracts rather than buying products. High tech capital equipment firms attracted by the potential revenue benefits are choosing to move from supplying product only to supplying product and services. This concept is known as ‘Servitization’. Through empirical evidence the academic literature has shown that businesses face challenges in undertaking the transformation from product to service provision and that organisational, cultural, commercial and operational challenges have the potential to erode the desired and expected benefits sought from such a transition. The research presented in this thesis investigates and identifies the features and challenges of servitization in the context of a complex engineering service provided by the UK Aerospace Defence industry. The research also explores the reported costs and front of mind costs for the provision of a complex engineering service. Particular attention is given to the problem of less than expected profitability during and post transformation to service. This research adopts a qualitative approach through the use of a single case study with multiple case examples of the complex engineering service. Findings identify a number of challenges associated with the transformation from product to service provision that include strategy, organisation and enterprise management, contracting, risk, culture and operations. Considering these findings holistically it is suggested that a paradigm shift needs to occur, changing both managers perspective and the business models employed if the firm is to provide a sustainable service offering. New ways of structuring and managing the enterprise to deliver the service value proposition will be required. This will include the development of performance management of all operations across the enterprise required as a minimum to ensure optimum performance of service delivery at lowest cost.","Ai","University of the West of England"
