"Title","Href","Author","Date","Abstract","Keywords","University Name"
"The design, development and application of novel, screen-printed amperometric glutamate biosensors","https://uwe-repository.worktribe.com/output/803754/the-design-development-and-application-of-novel-screen-printed-amperometric-glutamate-biosensors","Gareth Hughes","None","The aim of the studies presented in this thesis was to develop a screen-printed electrochemical biosensor for the measurement of glutamate and to apply this device to the determination of the analyte in food, serum and toxicity studies.  Chapter 1 serves as an introduction to both the physiological significance of glutamate and the fundamental principles underpinning the electrochemical techniques used throughout this thesis.  Chapter 2 is a review chapter, separated into two main sections. The first section details glutamate biosensors fabricated with glutamate oxidase (GluOx), the second section details biosensors fabricated with glutamate dehydrogenase (GLDH). The immobilization techniques, ease of fabrication and sample preparation techniques employed are compared. Biosensor characteristics such as sensitivity, limit of detection and linear range are summarised within a table.  The studies described in Chapter 3 focus on the development of a non-reagentless glutamate biosensor. A Meldola’s Blue screen-printed carbon electrode (MB-SPCE) was employed as the base transducer. The biosensor was constructed by drop coating the biopolymer chitosan (CHIT) and GLDH onto the surface of the MB-SPCE. For this study, NAD+ was present in free solution. Meldola’s Blue served as the electrocatalyst, whereby NADH produced by the GLDH/NAD+ reaction, was electrocatalytically oxidised at a low operating potential (+0.1V (vs. Ag/AgCl)). The applied potential, temperature, pH and concentration of the co-factors required for the biosensor operation were optimised in this study. The assay exhibited a linear range of 12.5 µM to 150 µM, limit of detection of 1.5 µM, response time of 2s and a sensitivity of 0.44 nA/ µM. The optimised biosensor was subsequently applied to the determination of endogenous and fortified concentrations of glutamate in both serum and food samples (OXO cubes). The serum was fortified with and the resulting mean recovery was 96% with a CV of 3.3% (n = 6). For the food sample, an unfiltered beef OXO cube was analysed for monosodium glutamate (MSG) content. The endogenous content of MSG was 125.43 mg/g, with a CV of 8.98% (n = 6). The solution was fortified with 100mM of glutamate and a resulting mean recovery of 91% with a CV of 6.39% (n = 6) was determined.  In Chapter 4, the glutamate biosensor was further developed in order to produce a reagentless device whereby the cofactor NAD+ and GLDH were immobilized on to the surface of the electrode utilising CHIT. The reagentless device was developed in order to monitor glutamate release from human liver carcinoma cells (HepG2) as a result of cell toxicity from exposure to paracetamol. The biosensor was miniaturised in the form of a microband biosensor, whereby one dimension of the electrode is of micrometre size and the other millimetre size. Micro bands exhibit unique diffusion properties in comparison to conventional sized electrodes. Calibration studies were carried out with an applied potential of +0.1V (vs. Ag/AgCl) using both phosphate buffer and cell media. In phosphate buffer the following microband biosensor characteristics were determined: linear range; 25 - 125µM, sensitivity; 0.0636 nA/µM and a theoretical limit of detection of 1.20µM. In cell media; linear range; 25 – 150 µM, sensitivity; 0.128 nA/µM and a theoretical limit of detection of 4.2µM. As the HepG2 cells were grown in an incubator at a fixed temperature and pH, studies were carried out at pH 7, 37ºC, in a 5% CO2 atmosphere. The miniaturised biosensor was applied to the determination of glutamate and the quantification was done by standard addition in cell media after 24 hours exposure to various concentrations of paracetamol. The average endogenous concentrations for glutamate released from the HepG2 cells was 52.07µM (CoV: 13.74%, n = 3), 93.30µM (CoV: 18.41%, n = 3) and 177.14µM (CoV: 14.54% n = 3) for 1mM, 5mM, 10mM doses of paracetamol respectively. The microband biosensor was also applied to the real time monitoring of glutamate over 8 hours. The standard deviations for the final current generated after eight hours are as follows; 1mM (coefficient of variation (CoV): 3.3%), 5mM (CoV: 9.056%) and 10mM (CoV: 13.18%). The study showed that the magnitudes of the steady state currents increased in proportion to the concentration of added paracetamol. The study also demonstrated the possibility of applying microband biosensors, over extended time periods, for toxicity studies; there is no significant removal of analyte owning to the small biosensor dimensions.  Chapter 5 describes the development of a reagentless conventional sized glutamate biosensor whereby the cofactor NAD+ and GLDH were immobilized using a combination of multi-walled carbon nanotubes (MWCNT), CHIT and additional water based MB in a layer-by-layer fashion. The MWCNT/CHIT/MB combination facilitates electron transfer to the surface of working electrode. The MWCNT/CHIT also entraps GLDH and the NAD+ on the surface of the electrode. The pH, temperature, optimum applied potential, concentrations of NAD+, CHIT and the addition of water-based MB were optimised. The electrocatalyst MB allowed a operating potential of +0.1V (vs. Ag/AgCl) to be utilised. The biosensor was examined with standard glutamate solutions and the following biosensor characteristics were determined; linear range; 7 - 105µM, LOD; 3 µM, sensitivity; 0.39 nA/µM, response time 20-30s. A food sample was analysed for MSG and found to contain 90.56 mg/g with a CV of 7.52% (n = 5). The reagentless biosensor was also applied to the determination of glutamate in serum. The endogenous concentration was found to be 1.44mM (n = 5), CV: 8.54%. The recovery of glutamate in fortified serum was 104% (n = 5), CV of 2.91%. The results indicate that the new biosensor holds promise for food and biomedical studies.","Tech","University of the West of England"
"Establishing the research priorities of paediatric emergency medicine clinicians in the UK and Ireland","https://uwe-repository.worktribe.com/output/803923/establishing-the-research-priorities-of-paediatric-emergency-medicine-clinicians-in-the-uk-and-ireland","Stuart Hartshorn; Ronan O'Sullivan; Ian K. Maconochie; Catherine Bevan; Francesca Cleugh;  Mark Lyttle","Nov 1, 2015","Objective: Paediatric Emergency Research in the UK and Ireland (PERUKI) is a collaborative clinical studies group established in August 2012. It consists of a network of 43 centres from England, Ireland, Northern Ireland, Scotland and Wales, and aims to improve the emergency care of children through the performance of robust collaborative multicentre research within emergency departments. A study was conducted regarding the research priorities of PERUKI, to establish the research agenda for paediatric emergency medicine in the UK and Ireland. Methods: A two-stage modified Delphi survey was conducted of PERUKI members via an online survey platform. Stage 1 allowed each member to submit up to 12 individual questions that they identified as priorities for future research. In stage 2, the shortlisted questions were each rated on a seven-point Likert scale of relative importance. Participants: Members of PERUKI, including clinical specialists, academics, trainees and research nurses. Results: Stage 1 surveys were submitted by 46/91 PERUKI members (51%). A total of 249 research questions were generated and, following the removal of duplicate questions and shortlisting, 60 questions were carried forward for stage 2 ranking. Stage 2 survey responses were submitted by 58/95 members (61%). For the 60 research questions that were rated, the mean score of 'relative degree of importance' was 4.70 (range 3.36-5.62, SD 0.55). After ranking, the top 10 research priorities included questions on biomarkers for serious bacterial illness, major trauma, intravenous bronchodilators for asthma and decision rules for fever with petechiae, head injury and atraumatic limp. Conclusions: Research priorities of PERUKI members have been identified. By sharing these results with clinicians, academics and funding bodies, future research efforts can be focused to the areas of greatest need.","Tech","University of the West of England"
"Play (for) time","https://uwe-repository.worktribe.com/output/804085/play-for-time"," Patrick Crogan","Jan 26, 2015","Through their deployment of interactivity, virtualisation and simulation, videogames are prime examples of the contemporary form of what philosopher of technology, Bernard Stiegler, has termed the industrial temporal object. The experiences produced by these media are constituted in the course of the flux of the interior consciousness of the individuals engaged in following—and in the interactive era, in co-producing—the flux of their unfolding. Consequently they are at the very crux both of the individual’s own development in relation to the exterior milieu and in the mutual dynamic of individual and collective becoming that is mediated by shared experience. This paper proceeds from the conviction that a principal tendency of this crucial influence is readable in the preemptive, anticipatory temporalisation constituted in the play-time associated with mainstream videogames in their conventional, designed adoption. I offer some reflections on the challenge to individual and cultural becoming associated with this tendency toward a preemptive comportment to time. I will argue that the ludic industrial temporal object exemplifies a wider tendency toward the radical destabilization of the dynamic of individuation happening at the always technical and prosthetic nexus of the “and” between individual and collective.","Tech","University of the West of England"
"NeuroProv - A visualisation system to enhance the utility of provenance Data for neuroimaging analysis","https://uwe-repository.worktribe.com/output/804381/neuroprov-a-visualisation-system-to-enhance-the-utility-of-provenance-data-for-neuroimaging-analysis","Bilal Arshad","None","E-Science platforms such as myGRID and NeuGRID for Users are growing at an amazing rate. One of the key barriers to their widespread use in practice is the lack of provenance data to support the reasoning and verification of experimental or analysis results. Clinical researchers use workflows to orchestrate the data present in e-science platforms in order to facilitate processing. Even though most systems capture provenance data and store it, systems rarely make use of it, thus limiting the exploitation of the true potential of such provenance. This thesis investigates mechanisms to visualise provenance data for neuroimaging analysis and to provide means to exploit the true potential of provenance data. In order to achieve this, a visualisation system has been implemented based on the use-cases that have been designed following requirements elicited for neuroimaging analysis. In this research a technique has been used to address the requirements of provenance visualisation for neuroimaging analysis. The prototype system has been tested against the provenance generated by NeuGRID for Users (N4U) as a proof of concept for our research. Different workflows have been visualised to study the efficacy of the proposed solution. Furthermore, evaluation metrics have been defined to determine whether the proposed solution is suitable for the purpose of the research conducted. The results show that the proposed visualisation system enhances the utility of provenance data for neuroimaging analysis and therefore the proposed research can be used to provide value to provenance data for neuroimaging analyses.","Tech","University of the West of England"
"Characterisation and description of compressible rubbery materials for component modelling","https://uwe-repository.worktribe.com/output/804389/characterisation-and-description-of-compressible-rubbery-materials-for-component-modelling","Nathan Townsend","None","Rubbery foams and similar highly compressible rubbery solids form an important class of materials for technology. In order for components made from such materials to be modelled, in Finite Element Analysis (FEA) for example, appropriate constitutive laws are required.  The review of the literature revealed that rubbery foams lacked the array of comprehensive data sets that have been published for near-incompressible rubbery materials for example. Moreover there were important contradictions between accounts of how rubbery foams behaved at finite strains. The review of the literature also raised some doubts on what the value of Poisson’s ratio (ν) should be for such materials in simple extension – let alone in compression.  Most finite strain FEA of rubbery foams seems to use in the constitutive law a finite strain version of ν based on logarithmic strains: here called the Poisson index, υ. Some of the implications of such approaches have been explored via theory and experiments. Some doubt has thereby been cast on such approaches.  In this project experiments performed in simple compression on a normal natural rubber latex foam have confirmed that the apparent Poisson ratio can fall to very low values even at rather small strains; the apparent Young modulus can drop to low values even at very small strains. The experiments have also indicated that: ν, and therefore υ at small strain simple extension, can be well below the value of 1/3 usually assumed; the value of υ can rise as extension progresses and can exceed ½.","Tech","University of the West of England"
"Briefing for design commission evidence session 2: Health and wellbeing","https://uwe-repository.worktribe.com/output/804471/briefing-for-design-commission-evidence-session-2-health-and-wellbeing"," Laurence Carmichael","Oct 20, 2015","Briefing Notes and Context The debate about the extent to which, and in what ways, our behaviour is affected by the built environment is not new. Whilst we might use emerging technology, visualising techniques and different data streams to extrapolate how behaviour might change in different environments, there is long standing discourse and disagreement as to how we should understand behaviour – or indeed, what kind of behaviour should be encouraged. This is a substantial topic, with a lot of work already in place. This Commission will aim to review and identity the best of the research already published, in addition to unpublished work that has been submitted to the Chairs as part of the evidence-gathering process.  Health and Wellbeing Whilst a supportive built environment is not enough on its own to ensure physical activity, it does facilitate it. However, an unsupportive built environment is an effective deterrent of physical activity and exacerbates social exclusion (source: TRB. 2005, evidence submitted to the Inquiry). It is this complex relationship between the built environment and health measures which defines the extent to which building design for healthy living could influence policy in this area. Whilst there is ample evidence on how well designed office environments improve the productivity of its employees, buildings where people live also have a substantial impact on their physical and mental wellbeing. Post-occupancy evaluations of residential buildings are not commonly commissioned by developer clients, and even less so by depleted local authorities. Questions to Consider at this Evidence Session:  What metrics are used in the field of health and wellbeing to measure the impact of the built environment? Which of these has landed well with policymakers?  What can architects and planners do to improve the evidence base? How can they be empowered to be able to undertake post-occupancy surveys?  What is a good starting point to undertake whole systems redesign of policy responsibility for healthy buildings, as outlined in Marcella Ucci’s submission?  What is the changing role of Public Health England? Is their interest in being a commissioning partner in large planning projects seen to be a success so far?","Tech","University of the West of England"
"Sustainable packaging: Regulations and operational challenges in a manufacturing SME","https://uwe-repository.worktribe.com/output/804499/sustainable-packaging-regulations-and-operational-challenges-in-a-manufacturing-sme","Gareth White; David Sarpong; Vera Ndrecaj","Jan 1, 2015","Copyright © 2015, IGI Global. The issue of sustainability has attracted considerable attention over the last decade and has been accompanied by the development of stringent packaging material legislation for firms. Drawing on a single case approach, this paper examines the operational challenges faced by manufacturing SMEs as they strive to meet the expectations and requirements of increasingly demanding sustainable packaging regulations. The findings highlight the internal costs and complexities that are faced by manufacturing firms when complying with the regulations. It suggests that some firms may face financial and technical constraints that prevent them from reporting the significant efforts that they are making to improving packaging materials. More significantly it identifies the seemingly insurmountable problems that are faced by SMEs when confronted with powerful upstream or downstream supply chain partners that are resistant to improvement initiatives. This can result in organisations acting in a self-interested manner and consequently, the cumulative environmental impact of the supply chain is greater than it may be if organisations were more environmentally cooperative.","Tech","University of the West of England"
"CML/CMIR camera tests Oct 2015","https://uwe-repository.worktribe.com/output/804630/cmlcmir-camera-tests-oct-2015","Terry Flaxton; Sarah Sparke","Oct 10, 2015","Centre for Moving Image Research and Cinematographers Mailing Lists began testing cameras and Camera Prototypes together in February 2014. These involved Professional Cinematographers and various professional crew members (Camera Assistants, Digital Imaging Technicians, plus BA, MA and PhD level students and various members of UWE Staff from technical instructors, research associates and also professorial level staff. CML is a well respected international professional discussion forum run by CMIR Visiting professor Geoff Boyle. Boyle also reports the outcomes of tests at National Association of Broadcasters Convention in Los Vegas and also International Broadcasting Conference in Amsterdam. The industry pays head to these tests. They take place at the Television Studio in Bower Ashton Campus. An important issue within doing industry and academic events together is the osmotic learning process where both disciplines learn from eachother. When we broaden these out to public events then the public also takes part in the learning process.  By mid 2015 it became apparent that there was a proliferation of new cameras and prototypes on the horizon so we decided to split these into cameras retailing at below £20,000 and those above that sum to half a million.","Tech","University of the West of England"
"Investigating social presence in the voice-based chat room and the text-based forum in the Chinese online learning context","https://uwe-repository.worktribe.com/output/804666/investigating-social-presence-in-the-voice-based-chat-room-and-the-text-based-forum-in-the-chinese-online-learning-context","None","None","Social presence has long been considered to be a key factor in enhancing learning in online contexts (Garrison, Anderson & Archer, 2000; Gunawardena & Zittle, 1997; Kehrwald, 2010; Ko, 2012; Tu, 2002b). New modes of online interaction, however, require researchers to engage in constant re-evaluation of social presence theory. This study set out to investigate online mediated interaction in the voice-based chat room and the text-based forum in the context of Chinese online education. The main aims were to compare the level of social presence generated using the two technological tools, to explore how learners form an online community and to contribute to theory in this area.  A mixed-method approach was taken to investigate levels of social presence, drawing on data from 124 questionnaires, 96 postings of text messages and 3 hours and 12 minutes of voice messages collected from the text-based forum and the voice-based chat room and eight one-hour interviews with students, either individually or in pairs. The answers to the questionnaires were subjected to statistical analysis, the interactional data of both the text and voice messages were analysed using Rourke et al.’s (2001) categories and indicators of social presence while the interviews were transcribed and subjected to a more qualitative analysis.  The statistical analysis of the questionnaires showed that students tended to use text to a much greater extent than voice, probably because of technical constraints, and that students’ perceptions of social presence in the two media were not significantly different. The analysis of the interactional data revealed that the density of social presence overall was slightly higher in the voice-based chat room than in the text-based forum, but the difference between the two media was not statistically significant. However, the density scores for the interactive category were shown to be significantly higher in the voice-based than in the text-based interaction, while the opposite was the case for the cohesive category. When affective categories were compared, text and voice data were not significantly different.  As the voice-based chat room was synchronous and had the advantage of sound, students became more involved in the communication and thus a greater sense of community was created. As students developed closer relationships with each other, cohesive features could be dispensed with in the voice-based chat room, and this was why the text-based forum had a higher density of cohesive features. Voice-based interaction clearly enhances social presence and a community of learning. However, for technical reasons, it is currently recommended that students work in small groups for discussion activities and learners should have strong technical support.  From a theoretical perspective, the study underlines the need for the constant renewal of analytical tools and categories in the face of rapidly evolving interactional practice online. The multi-media resources drawn upon by students may include social media as well as university platforms and the use of emoticons, special symbols, multiple punctuation, photos and video-clips –  not to mention the use of avatars and virtual worlds, which have not been considered in the context of the current study.","Tech","University of the West of England"
"Facts4Life primary school resource: Pilot evaluation report. Full technical report","https://uwe-repository.worktribe.com/output/804799/facts4life-primary-school-resource-pilot-evaluation-report-full-technical-report"," Emma Bird; Billie Oliver","Oct 1, 2015","None","Tech","University of the West of England"
"Development of an EMG controlled hand exoskeleton for post-stroke rehabilitation","https://uwe-repository.worktribe.com/output/804887/development-of-an-emg-controlled-hand-exoskeleton-for-post-stroke-rehabilitation","Hugo Alexandre Ferreira; Ana Moital;  Sanja Dogramadzi","Oct 1, 2015","© 2015 ACM. Rehabilitation after stroke is of crucial importance since patients often have severe motor impairments that affect their daily activities. In the past decades, a number of robotic systems have been proposed for stroke rehabilitation but very few of them are available in the market. Addition- ally, because of their high costs they are not widely accessi- ble. This paper presents a light-weight hand exoskeleton controlled by patient's surface electromyography (sEMG) signals. This system could empower the patient to inten- sively exercise the hand and control its movement with his/her muscles. This would personalise the rehabilitation process since the system will respond to patient's own effort to move. sEMG signals were acquired from the healthy forearm and pattern recognition techniques were used to distinguish ex- tension and exion of the index and middle fingers. The mo- torized exoskeleton imposed the corresponding movements in the hand wearing it. Individualization of finger move- ments was accomplished with more than 95% of accuracy and opening and closing motions were established by the exoskeleton in the opposite hand.","Tech","University of the West of England"
