"Title","Href","Author","Date","Abstract","Keywords","University Name"
"The impact of the Marine and Coastal Access Act (2009) on Welsh inshore fisheries and marine management","https://uwe-repository.worktribe.com/output/853191/the-impact-of-the-marine-and-coastal-access-act-2009-on-welsh-inshore-fisheries-and-marine-management","Alan Terry; Kerry Lewis; Blaise Bullimore","Jan 1, 2019","© 2018 Elsevier Ltd This paper is based on a qualitative study undertaken between April 2016 and February 2017 of key informants and secondary documents concerned with the management of the Welsh marine environment in the pre and post Marine and Coastal Access Act (2009) (MCAA) era. Since taking over direct responsibility for the Welsh marine environment, the Welsh Government has failed to integrate fisheries management and marine conservation as effectively as has been achieved by relevant English authorities, particularly Inshore Fisheries and Conservation Authorities (IFCAs). A key contributing factor to this failure is that, whilst MCAA created a clear statutory framework for England's IFCAs, Welsh Government resisted the imposition of similar management duties for Wales, and, subsequently, the National Assembly for Wales has not used its legislative powers to create a suitably robust Welsh regime. Furthermore, the suspension in 2016 of the stakeholder ‘Inshore Fisheries Groups’ has partly dismantled the relatively weak co-management regime in Wales. Although the Welsh Marine Fisheries Advisory Group remains, its scope has been much reduced. Post MCAA, the Welsh system has centralised decision making, creating a more remote and less responsive management structure than had existed previously.","Marine","University of the West of England"
"Damage characterization of nano-interleaved CFRP under static and fatigue loading","https://uwe-repository.worktribe.com/output/853271/damage-characterization-of-nano-interleaved-cfrp-under-static-and-fatigue-loading","Mohamad Fotouhi; Cristiano Fragassa; Sakineh Fotouhi; Hamed Saghafi; Giangiacomo Minak","Feb 1, 2019","© 2019 by the authors. The use of high strength-to-weight ratio-laminated fiber-reinforced composites is emerging in engineering sectors such as aerospace, marine and automotive to improve productivity. Nevertheless, delamination between the layers is a limiting factor for the wider application of laminated composites, as it reduces the stiffness and strengths of the structure. Previous studies have proven that ply interface nanofibrous fiber reinforcement has an effective influence on delamination resistance of laminated composite materials. This paper aims to investigate the effect of nanofiber ply interface reinforcement on mode I properties and failure responses when being subjected to static and fatigue loadings. For this purpose, virgin and nanomodified woven laminates were subjected to Double Cantilever Beam (DCB) experiments. Static and fatigue tests were performed in accordance with standards and the Acoustic Emissions (AE) were acquired during these tests. The results showed not only a 130% increase of delamination toughness for nanomodified specimens in the case of static loads, but also a relevant crack growth resistance in the case of fatigue loads. In addition, the AE permitted to relate these improvements to the different failure mechanisms occurring.","Marine","University of the West of England"
"Indoor positioning using auto sextant","https://uwe-repository.worktribe.com/output/855670/indoor-positioning-using-auto-sextant","Adam Zar;  Yaseen Zaidi; Simon Winberg","May 13, 2019","© 2019 IEEE. This paper reports on the construction of an automated mechatronic sextant utilized in determining positions relative to multiple observed objects in open spaces. The design is based on the basic principles of the conventional mariner's hand-held sextant. The device operates indoor or outdoors where it exploits the celestial presence of the sun. Image processing algorithms are applied to detect object features from which position coordinates are determined. The device is within 0° to 4° accurate for objects of different shapes and patterns when placed at similar elevation and range. The device can be used as a backup to the more sophisticated positioning systems that require extensive infrastructure to make an accurate location determination.","Marine","University of the West of England"
"Provenance of lower cretaceous quartz arenites from the northern Indian Plate: Tropical weathering or a multi-cycled sediment source?","https://uwe-repository.worktribe.com/output/855809/provenance-of-lower-cretaceous-quartz-arenites-from-the-northern-indian-plate-tropical-weathering-or-a-multi-cycled-sediment-source"," Hazel Beaumont; Stuart Burley; Thomas Gould; Stuart Clarke","Dec 18, 2018","Introduction. Lower Cretaceous sediments of the northwestern Indian Plate margin were deposited in the Barmer, Cambay, Narmada, Kachchh and Jaisalmer basins (Figure 1) of the West Indian Rift System (WIRS) and the Lower and Middle Indus Basins (LMIB; Figure 1). These fluvial and coastal plain sediments are dominated by mature quartz arenites (Baig et al., 2016). Such an extreme quartz-rich detrital mineralogy is surprising, given that the local highs flanking the WIRS comprise a variety of Precambrian basement rocks including the Malani Igneous Suite, the Delhi Supergroup, the Aravalli Mobile Belt, the Bundelkhand Craton and the Cambrian sediments of the Marwar Supergroup (Figure 2). Most published studies assume that the main source area for these quartz arenites is the Aravalli Mobile Belt, although there is little palaeogeographical or mineralogical evidence to support this. Presented here are new mineralogical data for the fluvial Ghaggar-Hakra Formation (Figure 3) of the Barmer Basin and a compilation of published detrital mineralogies of sandstones across the WIRS and LMIB, which are laterally equivalent to the Ghaggar-Hakra Formation. The aim here is to constrain the main provenance source areas during the Lower Cretaceous. Petrography. For the Ghaggar-Hakra Formation 99 thin sections (Figure 4) from both outcrop and core were point-counted. Virtually all the samples are quartz arenites or sublithic arenites with almost no detrital feldspar (see Figures 4 and 5). Published data for the WIRS indicates that the sandstones are predominantly quartz arenites or sub-lithic arenites (Figure 5), apart from in the Kachchh Basin which has an arkosic detrital composition (Figure 5). The LMIB sandstones are mineralogically classified as sub-lithic arenites (Figure 5).  Determining the Pre-diagenesis mineralogy. Studies indicate that these sediments have been affected by diagenesis (Baig et al., 2016; Bose et al., 1986; Desai and Desai, 1989; Racey at el., 2016; Zaighama and Mallick, 2000). To understand the source provenance it is necessary to reconstruct the original detrital mineralogy by: •	Adding oversized pores, grain-replacive calcite cement and authigenic kaolinite together to recalculate the original feldspar content, and;  •	Adding authigenic chlorite, smectite, opaque minerals and iron-replaced grains to the lithic total. These calculations indicate that the sandstones from the Barmer, Cambay, Narmada and Jaisalmer basins remain within the quartz arenite and sub-lithic arenite mineralogical ranges (Figure 6). The sandstones in the Kachchh Basin (Figure 6) are distinctly arkosic and the LMIB are within both the lithic arkose and feldspathic arenite mineralogical ranges (Figure 6). Discussion.  Major differences in the detrital mineralogy of Lower Cretaceous sandstones across the northern Indian Plate indicate that the widespread development of quartz arenites cannot be the result of deep tropical weathering, as previously reported. Rather, the mineralogical differences reflect variation in the source provenance. Using well established sandstone provenance triangular plots, the Lower Cretaceous sandstones within the WIRS and LMIB appear to be comprised of recycled quartzose, dissected arc and transitional continental mineralogical ranges. A detailed Lower Cretaceous palaeographical reconstruction of the northern Indian Plate margin inconjunction with the recalculated QFL mineralogical diagrams (Figure 1 and 7) suggests the Lower Cretaceous sediments of the Kachchh and LMIB are likely to be derived from local Saurashtra and Nagar-Parkar, highs whilst the sandstones of the Narmada, Cambay, Barmer and Jaisalmer basins are likely to be derived from the Marwar Supergroup and the lower reaches of the Aravalli Mobile Belt as the quartz here is second generation and has likely travelled long distances. The loss of feldspar within the sandstones is considered to be due to in-situ diagenesis and transportation of the sediments from the Marwar Supergroup and from the local highs (Figures 1, 2 and 7).    Figure captions: Figure 1: Palaeogeographical reconstruction of the Lower Cretaceous rifts and associated depositional systems on the northwestern Indian Plate. Distribution of the dominant alluvial facies, passing into fluvial sedimentation and then coastal plains, is based on Walther’s Law constrained by the widely spaced outcrops. The Indo-Tethys Ocean coastline is depicted by coastal sedimentation within the Indus, Jaisalmer, Miajilar, Rahn, Banni and Kachchh basins; these coastal sediments pass into shallow marine and deep marine sediments in present day Pakistan. The rivers feeding these basins and coastal sediments are sourced from the highs flankig the rift systems and the Aravalli Mountain Range. Palaeocurrents are predominantly from the south and southwest to the north and northeast, although extensively modified by rift basin geometry as in the case of the Barmer Basin. This palaeographical reconstruction (from Beaumont et al., 2018) is derived from multiple sources: Ahmad et al. (2012); Akhtar & Ahmed (1991); Aslam (1992); Bhatt et al. (2016); Biswas (1999); Casshyap & Aslam (1992); Chatterjee et al. (2013); Khalid et al. (2014); Kothari et al. (2015); Mukherjee (1983); Racey et al. (2016); Rai et al. (2013); Rajaram et al. (2017); Rao et al. (2015).  Figure 2: Basement composition map of northwestern India, mostly composed of intrusive and extrusive, felsic and mafic material, overlain by Precambrian, Cambrian and Jurassic sediments, based on Hus and Cathro, 2010; xxxxx; xxxxx. Inset of India in the top left corner displaying the location context and the India – ocean (blue dashed line) and the Indian – Pakistan border (dark blue line).  Figure 3: Simplified representative logs from the Ghaggar-Hakra Formation at outcrop displaying the typical facies from (a) the Darjaniyon-ki Dhani Sandstone, (b) the Sarnoo Sandstone, (c) the Nosar Sandstone, and (d) the fluvial Pushka Member of the Ghaggar-Hakra from a subsurface well in the Barmer Basin.   Figure 4: Thin section photographs from the Ghaggar-Hakra Formation, at both the outcrop and sub-surface; (a) Darjanyion-ki Dhani Sandstone quartz arenite displaying dominance of detrital grains of quartz with rock fragments, showing detrital grains coated by authigenic haematite, probably a replacement of iron-rich carbonate; (b) Typical Sarnoo sandstone dominated by detrital grains of quartz and minor muscovite. Oversized pores are interpreted to be feldspar dissolution porosity some of which are filled with authigenic kaolinite; (c) The Nosar Sandstone dominated by detrital grains of quartz, with oversized pores representing dissolved feldspars partially filled with authigenic kaolinite, and; (d) Fine grained sandstone from the subsurface dominated by strained monocrystalline quartz and sutured polycrystalline quartz grains with abundant oversized pores and pore-filling kaolinite together with haematite replacement detrital clay laminae.  Figure 5: QFL diagrams showing the composition of each sandstone; (a) Darjaniyon-ki Dhani Sandstone plots within the sub-lithic-quartz arenite to quartz arenite area, Sarnoo Sandstone plots within the sub-lithic-quartz arenite to quartz arenite area, the Nosar Sandstone plots within the sub-lithic-quartz arenite to quartz arenite ranges; (b) the Goru Sandstone of the Lower and Middle Indus Basins plots within the sub-lithic arenite and feldspathic arenite area (Berger et al., 2009 and Baig et al., 2016); (c) the Nimar Sandstone of the Narmada Basin dominantly plots within the quartz arenite and sub-lithic arenite areas (Racey et al., 2016); (d) the Himtnagar Sandstone of the Cambay Basin plots within the felds arenite range (Aquil, 1982); (e) the Pariwar Sandstone of the Jaisamler Basin plots within the sub-feldspathic arenite area (Racey et al, 2016); (f) The Ghaggar-Hakra Formation from the subsurface of the Barmer Basin which plots dominantly within the quartz arenite and sub-lithic arenite areas.  Figure 6: Recalculated QFL diagrams in which oversized pores and authigenic kaolinite are added to the feldspar total in the original mineralogy  (full method is set out in the text); (a) The Ghaggar-Hakra Formation at outcrop plots within the quartz arenite, sub-feldspathic arenite and sub-lithic arenite fields; (b) The Ghaggar-Hakra Formation from the subsurface of the Barmer Basin plots within the quartz-arenite, sub-feldspathic arenite, sub-lithic arenite and feldspathic arenite; (c) the sediments of the LMIB are sub-lithic arenite, feldspathic arenite and lithic arenite, and; (d) the sediments of the WIRS are feldspathic arenites and quartz arenites (Racey et al., 2016 and Aquil, 1982). Figure 7: The pre-Cretaceous basement composition map overlain with the QFL compositional diagrams.","Marine","University of the West of England"
"Investigating the pre-damaged PZT sensors under impact traction","https://uwe-repository.worktribe.com/output/856965/investigating-the-pre-damaged-pzt-sensors-under-impact-traction","Sakineh Fotouhi; Mohammad Fotouhi; Ana Pavlovic; Nenad Djordjevic","Nov 19, 2018","© 2018 by the authors. Ships are usually under vibration, impact, and other kinds of static and dynamic loads. These loads arise from water flow across the hull or surfaces, the propeller cavitation, and so on. For optimal design purposes and reliable performance, experimental measurements are necessary. These sensors are often used under or near the water, working conditions that improve the risk of sensor damage. This paper aims at investigating, by the use of finite elements, the behavior of damaged piezoelectric sensors under traction and impact loads. The numerical method was calibrated using results available in the literature regarding piezoelectric and elastic plates with a central crack. After calibration, the simulation was used on two types of Lead-Zirconium-Titanium oxide (PZT) sandwich panel structures reinforced by aluminum skins. The results proved that the damage size and impact energy are important factors affecting the response of piezoelectric sensors; therefore, special attention might be considered when using these sensors for marine applications.","Marine","University of the West of England"
"Basin-scale variability of microbial methanol uptake in the Atlantic Ocean","https://uwe-repository.worktribe.com/output/858100/basin-scale-variability-of-microbial-methanol-uptake-in-the-atlantic-ocean","Dr Stephanie Sargeant; J Colin Murrell; Philip N Nightingale; Joanna D Dixon","Aug 28, 2018","© 2018 Author(s). Methanol is a climate-active gas and the most abundant oxygenated volatile organic compound (OVOC) in the atmosphere and seawater. Marine methylotrophs are aerobic bacteria that utilise methanol from seawater as a source of carbon (assimilation) and/or energy (dissimilation). A few spatially limited studies have previously reported methanol oxidation rates in seawater; however, the basin-wide ubiquity of marine microbial methanol utilisation remains unknown. This study uniquely combines seawater 14C labelled methanol tracer studies with 16S rRNA pyrosequencing to investigate variability in microbial methanol dissimilation and known methanol-utilising bacteria throughout a meridional transect of the Atlantic Ocean between 47° N to 39° S. Microbial methanol dissimilation varied between 0.05 and 1.68nmolL-1h-1 in the top 200m of the Atlantic Ocean and showed significant variability between biogeochemical provinces. The highest rates of methanol dissimilation were found in the northern subtropical gyre (average 0.99±0.41nmolL-1h-1), which were up to 8 times greater than other Atlantic regions. Microbial methanol dissimilation rates displayed a significant inverse correlation with heterotrophic bacterial production (determined using 3H-leucine). Despite significant depth stratification of bacterial communities, methanol dissimilation rates showed much greater variability between oceanic provinces compared to depth. There were no significant differences in rates between samples collected under light and dark environmental conditions. The variability in the numbers of SAR11 (16S rRNA gene sequences) were estimated to explain approximately 50% of the changes in microbial methanol dissimilation rates. We estimate that SAR11 cells in the Atlantic Ocean account for between 0.3% and 59% of the rates of methanol dissimilation in Atlantic waters, compared to","Marine","University of the West of England"
"Plant-animal worms round themselves up in circular mills on the beach","https://uwe-repository.worktribe.com/output/864197/plant-animal-worms-round-themselves-up-in-circular-mills-on-the-beach","Ana Sendova-Franks; Nigel Franks; Alan Worley","Jul 1, 2018","© 2018 The Authors. Collective motion is a fascinating and intensely studied manifestation of collective behaviour. Circular milling is an impressive example. It occurs in fishes, processionary caterpillars and army ants, among others. Its adaptive significance, however, is not yet well understood. Recently, we demonstrated experimentally circular milling in the marine plant-animal worm Symsagittifera roscoffensis.We hypothesized that its function is to gather the worms and facilitate the dense films they form on the beach to promote the photosynthesis of their symbiotic algae. Here, we report for the first time, to our knowledge, the occurrence of S. roscoffensis circular mills in nature and show that it is by no means rare. The size and behaviour of circular mills in their natural environment is compatible with our earlier experimental results. This makes S. roscoffensis a good study system for understanding the proximate and ultimate mechanisms of circular milling.","Marine","University of the West of England"
"Sea of possibilities: Old and new uses of remote sensing data for the enforcement of the Ascension Island marine protected area","https://uwe-repository.worktribe.com/output/865433/sea-of-possibilities-old-and-new-uses-of-remote-sensing-data-for-the-enforcement-of-the-ascension-island-marine-protected-area","Dr Tom Appleby; Dr Matthew Studley; Brendon Moorhouse; Judith Brown;  Chad Staddon;  Emma Bean","2021-05","Very large marine protected areas are in danger of becoming 'paper parks'. This paper uses an interdisciplinary team to investigate the use of remote sensing technologies to provide sufficient evidence for effective fisheries management. It uses the intended marine protected area around Ascension Island as a case study. Satellite technology provides opportunities to detect the presence of fishing vessels but because of difficulties with data interpretation, it is unlikely to be a sole source of evidence for prosecutions. Developing drone technology and traditional over-flights by aerial surveillance may supplement satellite technology with 'eyewitness’ evidence. Well-crafted regulations will be able to make some use of this data, but the evidential requirements of criminal courts make prosecutions difficult to pursue. There is some scope to expand management opportunities through vesting the fishery in a public body and pursuing offenders through civil law, this approach having a different suite of remedies.  Other opportunities lie in giving very large marine protected areas legal personality which has similar advantages and additional reputational benefits. Using remote sensing data in the civil court poses evidential problems. An alternative approach is to collate data around frequent infringers and, by negatively impacting on their reputation, restrict their ability to obtain insurance, finance, access to fisheries and market access. This is exemplified in port state measures by fisheries authorities and chain of custody requirements by labeling bodies. Data sharing raises challenges with intellectual property and coordination. The paper demonstrates that there are opportunities to make VLMPAs work more effectively.","Marine","University of the West of England"
"Development and evaluation of a novel piezoelectric PVDF sensor as a load spectrum counter","https://uwe-repository.worktribe.com/output/866064/development-and-evaluation-of-a-novel-piezoelectric-pvdf-sensor-as-a-load-spectrum-counter","Meghna De; Thomas Pozegic; Ian Hamerton; Mohammad Fotouhi","Jun 25, 2018","Engineering structures, such as aircraft, marine vessels, buildings and offshore platforms, are subjected to a range of uncertain dynamic loadings, due to changes in operational and environmental conditions, etc. Unfortunately, the load spectrum of these structures is usually an unknown with no appropriate device to assess it, leading to over-engineered structures. This project introduces a novel piezoelectric based sensor as a load spectrum counter that can measure the complex loading conditions over the structure's lifetime. The sensor has been designed using piezoelectric poly(vinylidene fluoride) (PVDF) combined with a custom electronic circuit, which counts the number of times the load in a structure surpasses pre-selected amount. Any force applied to the piezoelectric PVDF sensor generates an electrostatic output voltage due to the separation of charges in the atomic structure of the piezoelectric. The output from the piezoelectric PVDF (PE-PVDF) is a pulse wave with an amplitude proportional to the load input and an amplifier connected to the level detector used to enhance the pulse. When the amplitude of the data pulse exceeds a certain level, a signal emitted by the level detector activates the counter and stores the data. To prevent counting of noise an adjustable dead zone is added at each level detector. Therefore, after the load surpasses a specified level and a count is registered, no action occurs (i.e. the output is zero) and the load must drop under the dead zone and then rise again before another count is registered. The concept is validated experimentally both on an aluminium and epoxy/SE70 glass composites yielding load-spectra. The sensor is calibrated for different materials and geometrical conditions need to be investigated. The vision of the project is to make wireless and embedded fatigue counter sensors designed for real industrial applications.","Marine","University of the West of England"
"Captive in cycles of invisibility? Prisoners’ work for the private sector","https://uwe-repository.worktribe.com/output/866291/captive-in-cycles-of-invisibility-prisoners-work-for-the-private-sector"," Jenna Pandeli; Michael Marinetto; Jean Jenkins","Aug 1, 2019","© The Author(s) 2018. This article critiques a case of modern prison-labour by exploring prisoners’ attitudes towards the prison-work they undertake while incarcerated. The study is based at a privatised male prison in the UK, assigned the pseudonym ‘Bridgeville’. Bridgeville contracts with private-sector firms in providing market-focused prison-work – so-called real work – for inmates in some of its workshops. In exploring prisoners’ perceptions of this privatised prison-work, it is found that it mainly comprises mundane, low-skilled activities typical of informalised, poor-quality jobs that are socially, legally and economically devalued and categorised as forms of ‘invisible work’. At Bridgeville, such privatised prison-work largely fails in engaging or upskilling inmates, leaving them pessimistic about its value as preparation for employment post-release. Its rehabilitative credentials are therefore questioned. The article contributes to the debate around invisible work more generally by problematising this example of excluded work and the cycle of disadvantage that underpins it.","Marine","University of the West of England"
"Developing university-society partnerships with a focus on climate change impact research using the ‘business assist’ model","https://uwe-repository.worktribe.com/output/872650/developing-university-society-partnerships-with-a-focus-on-climate-change-impact-research-using-the-business-assist-model","S Ward; D Butler; R Adams; S O'Callaghan; N Warren; M Wickett; H Swire; S de Mora; C Uden","Jan 1, 2018","This article explores the experiences generated through a programme of engaged research with university–society partnerships focused on businesses, climate change impacts and environmental technologies. The programme was co-created through research and development collaborations between a university, several large organizations, including the Met Office, Plymouth Marine Laboratory, Regen SW and IBM, and ten small to medium-sized enterprises (SMEs). Through a critically reflective narrative account and two case studies, which represent the perspectives of all involved, this article considers the processes of engagement, their effectiveness, the outcomes delivered and recommendations, as well as the context and influence of European policy – represented by the 'business assist' (BA) model – on creating engaged research. The co-creation of mutually beneficial space emerged as a key success factor, which challenged the short-term focus of the BA model.","Marine","University of the West of England"
